{
  "documentType": "d2p:fit-profile",
  "schemaVersion": "1.0.0",
  "artifactId": "art_golden-tshirt-fit-profile-regular",
  "revisionId": "rev_golden-tshirt-fit-profile-regular-r1",
  "name": "Regular fit (synthetic)",
  "intent": "d2p:regular",
  "definitionRegistries": [
    {
      "id": "d2p:measurement-definitions",
      "version": "1.0.0"
    }
  ],
  "easeRules": [
    {
      "id": "ease-chest",
      "bodyDefinitionId": "d2p:body.chest-girth",
      "garmentDefinitionId": "d2p:garment.chest-girth",
      "easeType": "wearing",
      "amount": {
        "value": 100,
        "unit": "mm"
      },
      "priority": 0,
      "scope": {
        "zones": [
          "d2p:chest"
        ]
      }
    }
  ],
  "materialAssumptions": {
    "materialClass": "woven"
  }
}
