{
  "documentType": "d2p:fit-profile",
  "schemaVersion": "1.0.0",
  "artifactId": "art_example-fit-profile",
  "revisionId": "rev_example-fit-profile-r1",
  "name": "Example regular fit",
  "intent": "d2p:regular",
  "definitionRegistries": [
    {
      "id": "d2p:measurement-definitions",
      "version": "1.0.0"
    }
  ],
  "easeRules": [
    {
      "id": "ease-chest",
      "bodyDefinitionId": "d2p:body.chest-girth",
      "garmentDefinitionId": "d2p:garment.chest-girth",
      "easeType": "wearing",
      "amount": {
        "value": 100,
        "unit": "mm"
      },
      "priority": 0,
      "scope": {
        "zones": [
          "d2p:chest"
        ]
      }
    },
    {
      "id": "ease-chest-knit",
      "bodyDefinitionId": "d2p:body.chest-girth",
      "garmentDefinitionId": "d2p:garment.chest-girth",
      "easeType": "design",
      "amount": {
        "value": -20,
        "unit": "mm"
      },
      "priority": 1,
      "scope": {
        "sizeKeys": [
          "size-a",
          "size-b"
        ],
        "zones": [
          "d2p:chest"
        ]
      },
      "materialCondition": {
        "materialClasses": [
          "knit"
        ],
        "minStretchRatio": 0.2
      }
    }
  ],
  "fitTargets": [
    {
      "id": "fit-chest-range",
      "garmentDefinitionId": "d2p:garment.chest-girth",
      "comparison": "range",
      "min": {
        "value": 980,
        "unit": "mm"
      },
      "max": {
        "value": 1120,
        "unit": "mm"
      },
      "priority": 0
    },
    {
      "id": "fit-sleeve-min",
      "garmentDefinitionId": "d2p:garment.sleeve-length",
      "comparison": "min",
      "min": {
        "value": 180,
        "unit": "mm"
      },
      "priority": 2,
      "scope": {
        "sizeKeys": [
          "size-a"
        ]
      }
    }
  ],
  "materialAssumptions": {
    "materialClass": "woven",
    "stretch": {
      "lengthwise": 0,
      "crosswise": 0.02
    },
    "description": "Synthetic example: plain-weave cotton, no elastane."
  },
  "sizeSystemRef": {
    "artifactId": "art_example-size-system",
    "revisionId": "rev_example-size-system-r1"
  }
}
